{
  "$schema": "https://json-schema.org/draft/2020-12/schema",
  "$id": "https://empalme/bitacora.schema.json",
  "title": "Bitácora de un grupo del laboratorio",
  "description": "Lo que un grupo registra sobre UNA política pública (área, ADR-0004) comparando los dos gobiernos. Se llena en la plantilla .docx y el equipo la convierte a este JSON con extraccion/bitacora.py (ADR-0005). Convención de celdas: string = lo que escribió el grupo; null = HUECO de información declarado ('Sin dato': la fuente no lo dice, es un hallazgo); clave ausente = no llenado (y aparece en `sin_llenar`).",
  "type": "object",
  "required": [
    "version",
    "sector",
    "grupo",
    "politica",
    "ubicacion",
    "instrumentos",
    "aportes",
    "subcategorias",
    "fuentes",
    "sin_llenar"
  ],
  "additionalProperties": false,
  "properties": {
    "version": {
      "const": 4,
      "description": "versión de la estructura de la plantilla (la v4 del equipo)"
    },
    "sector": {
      "type": "string",
      "description": "slug del sector (p. ej. ciencia-tecnologia)"
    },
    "grupo": {
      "type": "object",
      "required": [
        "nombre",
        "integrantes"
      ],
      "additionalProperties": false,
      "properties": {
        "nombre": {
          "type": "string"
        },
        "integrantes": {
          "type": "array",
          "items": {
            "type": "string"
          }
        },
        "motivo": {
          "type": "string",
          "description": "por qué el grupo eligió esta política"
        },
        "expectativa": {
          "type": "string",
          "description": "qué esperaba encontrar: la hipótesis inicial, antes de comparar"
        }
      }
    },
    "politica": {
      "type": "object",
      "required": [
        "nombre"
      ],
      "additionalProperties": false,
      "properties": {
        "nombre": {
          "type": "string",
          "description": "como la escribió el grupo"
        },
        "id": {
          "type": "string",
          "description": "id del área en el dataset del sector, si el nombre la identifica"
        }
      }
    },
    "ubicacion": {
      "$ref": "#/$defs/por_vigencia_ubicacion"
    },
    "comparabilidad": {
      "$ref": "#/$defs/celda",
      "description": "tabla puente: qué es comparable entre los dos informes y qué no (sección 1)"
    },
    "instrumentos": {
      "type": "array",
      "description": "sección 2: hasta tres instrumentos que el grupo escogió; solo las filas con algo escrito",
      "items": {
        "type": "object",
        "minProperties": 1,
        "additionalProperties": false,
        "properties": {
          "nombre": {
            "$ref": "#/$defs/celda"
          },
          "2018-2022": {
            "$ref": "#/$defs/celda",
            "description": "qué pasó con el instrumento en ese gobierno"
          },
          "2022-2026": {
            "$ref": "#/$defs/celda"
          },
          "relevancia": {
            "$ref": "#/$defs/celda",
            "description": "por qué el grupo lo escogió"
          }
        }
      }
    },
    "aportes": {
      "type": "array",
      "description": "sección 3: lo que el grupo propone corregir, añadir, conectar o reclasificar en la red, o sus dudas; solo las filas con algo escrito",
      "items": {
        "type": "object",
        "required": [
          "tipo"
        ],
        "additionalProperties": false,
        "properties": {
          "tipo": {
            "type": "string",
            "description": "corregir · anadir · conectar · reclasificar · duda · otro (o la etiqueta que escribió el grupo)"
          },
          "elemento": {
            "type": "string",
            "description": "el elemento o la relación de la red"
          },
          "propuesta": {
            "type": "string"
          },
          "evidencia": {
            "type": "string",
            "description": "evidencia o fuente"
          }
        }
      }
    },
    "subcategorias": {
      "$ref": "#/$defs/por_vigencia_subcategorias",
      "description": "sección 4: las siete subcategorías (4.1 a 4.7)"
    },
    "fuentes": {
      "type": "array",
      "description": "sección 5: fuentes externas que el grupo usó (más allá del informe de empalme)",
      "items": {
        "type": "object",
        "minProperties": 1,
        "additionalProperties": false,
        "properties": {
          "fuente": {
            "type": "string"
          },
          "aporte": {
            "type": "string"
          },
          "referencia": {
            "type": "string",
            "description": "página, enlace o documento"
          }
        }
      }
    },
    "complejidad": {
      "$ref": "#/$defs/celda",
      "description": "sección 6: qué patrones cree el grupo que pueden emerger al ver cómo interactúan las políticas"
    },
    "hallazgos": {
      "$ref": "#/$defs/celda",
      "description": "sección 7: hallazgo principal, lo que no era evidente al comienzo"
    },
    "hipotesis": {
      "$ref": "#/$defs/celda",
      "description": "sección 7: qué patrón cree el grupo que podría repetirse en otras políticas (para la sesión 2)"
    },
    "notas": {
      "type": "object",
      "additionalProperties": {
        "type": "string"
      },
      "description": "aclaraciones de los huecos, por ruta: «Sin dato: <nota>» en la plantilla -> la celda es null y la nota va aquí"
    },
    "sin_llenar": {
      "type": "array",
      "items": {
        "type": "string"
      },
      "description": "rutas (p. ej. subcategorias.2022-2026.normativa, o grupo / integrantes / politica / motivo / expectativa) que quedaron vacías: no son huecos declarados. Los datos del grupo vacíos quedan como \"\" o [] (o se omiten, en motivo y expectativa) y se listan aquí. Instrumentos, aportes y fuentes vacíos no se listan: son opcionales"
    }
  },
  "$defs": {
    "celda": {
      "type": [
        "string",
        "null"
      ]
    },
    "ubicacion": {
      "type": "object",
      "additionalProperties": false,
      "properties": {
        "ubicacion": {
          "$ref": "#/$defs/celda",
          "description": "sección, capítulo o páginas"
        },
        "indicador": {
          "$ref": "#/$defs/celda",
          "description": "indicador o forma de reporte"
        },
        "valor": {
          "$ref": "#/$defs/celda",
          "description": "valor y referencia"
        }
      }
    },
    "subcategorias": {
      "type": "object",
      "additionalProperties": false,
      "properties": {
        "objetivo": {
          "$ref": "#/$defs/celda"
        },
        "instituciones": {
          "$ref": "#/$defs/celda"
        },
        "poblacion": {
          "$ref": "#/$defs/celda"
        },
        "normativa": {
          "$ref": "#/$defs/celda"
        },
        "recursos": {
          "$ref": "#/$defs/celda"
        },
        "metas": {
          "$ref": "#/$defs/celda"
        },
        "impacto": {
          "$ref": "#/$defs/celda"
        }
      }
    },
    "por_vigencia_ubicacion": {
      "type": "object",
      "required": [
        "2018-2022",
        "2022-2026"
      ],
      "additionalProperties": false,
      "properties": {
        "2018-2022": {
          "$ref": "#/$defs/ubicacion"
        },
        "2022-2026": {
          "$ref": "#/$defs/ubicacion"
        }
      }
    },
    "por_vigencia_subcategorias": {
      "type": "object",
      "required": [
        "2018-2022",
        "2022-2026"
      ],
      "additionalProperties": false,
      "properties": {
        "2018-2022": {
          "$ref": "#/$defs/subcategorias"
        },
        "2022-2026": {
          "$ref": "#/$defs/subcategorias"
        }
      }
    }
  }
}
